Link	Customer Name	Customer Company Size	Customer Industry	Case Study Content
https://6sense.com/customer-stories/khoros-delivers-personalized-web-experiences-to-their-most-valuable-audiences/	Khoros	Large	computer software	"Khoros provides a leading customer engagement platform that empowers organizations to build long-lasting relationships with their customers — and prospects — by creating powerful communities, managing social media communications, and aggregating feedback in a central location.  The team at Khoros leverages 6sense to deliver personalized web experiences, shorten deal cycles, and increase average deal size. With 6sense:  Sales cycles shortened by 42% Deal size increased 16% The challenge Khoros was doing a great job at providing a relevant user experience on its website … but it knew it could do more. Khoros’ site could more deeply resonate with visitors if it delivered personalized messaging aligning with  individual buyers’ unique needs.  Driving that level of customization with a two-person marketing team could be challenging. “We don’t have a lot of resources. Something like this honestly could take a whole full-time position,” explains Nathan Stull, Khoros’ senior manager of web marketing.  Stull and others knew they needed an alternative solution to realize their goals — while also maintaining a lean team and tech stack.  The solution Khoros turned to 6sense and Bound360 to tackle the challenge. Getting started was simple thanks to seamless integrations between 6sense, Bound360, and the team’s existing tech stack (which included Salesforce).  Rather than create unique content experiences across the website for all of Khoros’ constituents, Stull and his team realized they could take a phased approach that mitigated risk through tech integrations. They could incrementally build on small successes.  “You don’t have to do it all right away,” Stull says. “You don’t even need to know all the audiences. All you need is a high quality audience.  From there, you have a launching pad.”  Mary Clare Davis, vice president of strategy and product at Bound360, concurs.  “People get daunted because there is so much you can do,” she says. “That’s what we always say to our customers: ‘Pick one goal for that audience.’ Don’t allow the possibilities to overwhelm you.”  Powerful personalization with global ambitions Stull creates personalized web experiences based on Khoros’ internal data, 6sense intent data, and Bound360’s behavioral data. He relies on Bound360 to build the customized campaigns and successfully deliver the right content to the right audience. This enables Stull and his team to focus on strategy.  “There are top industries we target, segments in 6sense we use, and also user behavior [from Bound360] to segment and enhance their web experience,” he explains.  With this powerful tech combination in place, Khoros now personalizes huge sections of its website. Numerous modules and entire pages now cater to the specific needs and concerns of the users landing on the site.  And it’s creating a big impact. Recently, a personalized content experience on the site drove 68% of all registrations to a Khoros event.  “What’s really interesting is how in six months it’s evolved so much,” Stull says. The team rapidly went from no personalization to now dreaming about global expansion. Discussions are already underway for personalizing the company’s sites for Australia, France, and Germany.  The company is a shining standard for website personalization, says Bound360’s Davis.  “Khoros has been the perfect user of a personalization solution because they have a really clear idea of who they want to target and what they want those people to see,” she says.  The results Stull and his team now deliver personalized web content to a diverse set of audiences. Within six months, the team’s personalization efforts have driven real results, including:  22% of all visitors received personalization More than 4x increase in demo request conversion rate for visitors who saw personalization Pages per session was nearly 2x higher for visitors who engaged with personalization These results have enabled Stull to highlight his team’s impact to the wider organization."
https://6sense.com/customer-stories/manufacturer-nanawall-gains-the-competitive-edge-with-6sense/	NanaWall	Small	manufacturing	"NanaWall, a major manufacturer of opening glass wall systems, isn’t a newcomer to Account-Based Marketing (ABM). In fact, the industry leader used an account-based approach to sales and marketing before “ABM” was a common phrase.  For years, NanaWall’s revenue team paired its ABM strategy with a few predictive analytics tools that helped score opportunities. But 6sense dramatically improved the team’s efficiency and impact by empowering it to:  Capture information about website visitors Trace non-click ad engagement Evaluate ad placement Coordinate marketing and sales efforts The challenge The manufacturing industry isn’t a big user of martech, which had been a longtime competitive differentiator for NanaWall.  But as ABM and predictive analytics technologies continually improved, NanaWall sought to maintain its industry-leading position. It took a look at 6sense.  6sense’s ability to combine account fit and engagement scoring especially intrigued stakeholders at Nanawall. Other solutions simply focused on account fit.  Benefits drive insights & growth NanaWall became an enthusiastic user of 6sense. The list of benefits its revenue team discovered underscores why its efforts have been so successful. 6sense can:  Extend predictive solutions in existing CRMs Create campaigns and segments hyper-targeted to accounts Exclude accounts from display Build dynamic segments that learn and adjust to criteria Establish filters to bubble up people or accounts ready for attention That last one is one of Rapolla’s favorites. “This feature is really awesome because we don’t have to re-analyze our audience and create new, static buckets,” he says. “We establish filters that automatically feed people or accounts into a segment that meets them when they need to be met.”  Making the invisible visible 6sense’s engagement analytics made an enormous — and immediate — difference for NanaWall. While there are tried-and-true tactics that produce good leads for follow-up, buyers continually conduct research in ways that selling teams can’t see.  “There’s so much engagement that happens on the website, and since people don’t fill out forms, we don’t know who they are,” Rapolla says. “And if we don’t know who they are, we don’t have the ability to target them when that engagement happens. Using 6sense to uncover this data is big.”  Advertising success beyond click-through rates 6sense’s digital ad capabilities are also a game-changer for NanaWall. The platform delivers robust insights on campaign performance, including account view-through rate.  VTR offers more actionable information than traditional click-through rate information does. This is because VTR reveals the accounts that are seeing NanaWall’s ads but aren’t necessarily clicking through.  Before 6sense, NanaWall assumed that when ad campaigns didn’t generate a high click-through rate weren’t working. But with 6sense, stakeholders can now see when accounts exposed to those ads (but didn’t click through) visit the company’s website anyway.  This additional intent data helps inform valuable next steps for NanaWall’s revenue team.  The results NanaWall has extended its use of 6sense to the entire revenue team. Now the sales team interprets and leverage marketing-campaign data to guide hyper-targeted, account-based outreach.  NanaWall’s industry-leading use of 6sense transformed its ability to reach and evaluate accounts. Its teams can now:  Break down the invisible wall around website visitors Follow ad effectiveness without click-through rates Ensure ad placement on reputable sites Unite efforts across marketing and sales And stakeholders like working with 6sense, too.  “Beyond the capabilities of the platform, a core influencer for choosing 6sense is working with the people,” Rapolla says. “Our use case is very unique and atypical. So we needed a little more attention, even though we are a small company. We were able to get that from 6sense.”"
https://6sense.com/customer-stories/conversational-email-the-compass-in-vendavos-tech-stack/	Vendavo	Large	computer software	"For pricing management and optimization platform, Vendavo, poor timing on lead follow-ups resulted in money lost.  “Leads would come in, and they would just sit there for days and weeks or were ignored completely,” Steve Hastert, Director of Marketing at Vendavo, explains.  Those leads no longer go ignored, thanks to 6sense Email Agents, an AI-powered tool that makes it easy to scale personalized email conversations with thousands of buyers.  Vendavo participated in 6sense’s Email Agent beta in summer 2022. Within just a few weeks, Email Agents helped a lean sales team engage thousands of contacts and increase average meetings booked by 10%.  Let’s dive deeper into the challenges facing Vendavo’s sales team and how 6sense helps rookie sales team members close more deals.  The challenge: Making a big impact with a lean SDR team Like many growing businesses, Vendavo has a small team of sales development representatives (SDRs): five in the U.S. and three in Europe, each with a tenure of around five months. When it comes to engaging prospects, this short tenure can put the SDRs at a disadvantage, explains Rich Fong, Vendavo’s Senior Manager of Sales Development.  “Learning our product is not easy,” he explains, “It’s software, and it’s a lot to learn. It is hard for SDRs to get on board quickly, come up with messaging, and get in front of all the leads.”  Vendavo’s ideal customer profile includes manufacturers and distributors that generate more than $1 billion annually. Thousands of companies are within Vendavo’s total addressable market (TAM), which means each SDR has hundreds of contacts.  “An SDR can’t do the research and personalization for everyone engaging with us,” Rich says. “Email Agents helped us bridge that execution gap.”  Rich Fong Senior Manager, Sales Development, Vendavo The Solution: AI-Powered Assistant, ‘Lisa’ 6sense Email Agents are AI-powered personalization tools that streamline conversations between sales reps and contacts by automatically writing emails and responding to replies at scale. Email Agents treat every opportunity with high-quality engagement by replying to emails at any time, looping in necessary people, and understanding out-of-office messaging.  Email Agents have now become a staple in Vendavo’s go-to-market strategy.  “It started as a solution to just generate emails. But now, Email Agents are fully executing campaigns and following up with leads that our SDRs didn’t have the bandwidth to go after.”  Rich Fong Senior Manager, Sales Development, Vendavo Vendavo website visitors who download content such as data sheets and ebooks are placed into an MQL dashboard visible to SDRs. Then the Email Agents takes over.  After a seven day waiting period, an AI-assistant named ‘Lisa’ will begin outreach. Companies using Email Agents select the name of the AI-assistant, which handles everything from initial outreach to scheduling follow-ups.  Rich also mentioned that all SDRs are part of the 6QA (6sense Qualified Account) process, which enables revenue teams to align on when in-market accounts are ready to convert into an opportunity. This enhances their AI-assisted email strategy because SDRs can prioritize which accounts to engage via email.  The Results When it comes to the overall impact, Rich and Steve are on the same page.  “Looking forward to the future, I feel excited about additional campaigns we can run with Email Agents, potential 6QA accounts, event leads, or areas we might need help on,” Rich says.  “The most impactful thing is reaching out to those folks we had talked to and then moved on from. Getting those back in the sales process has been the biggest win,” Steve says. Rich adds, “It’s given us more clarity on what’s hot or not regarding accounts. I also liken it to a compass. It directionally helps us find those hot or not accounts. Our sellers can see it. Our SDRs can see it. Our marketers can see it.”  In just six weeks, the AI assistant delivered the same results as three human SDRs, totaling:  24 qualified contacts Nine meetings booked Two opportunities Results grew significantly, and in 2022 overall, the AI Assistant ‘Lisa’ delivered for Vendavo 66 qualified contacts, 19 meetings booked, and 10 opportunities totaling $3.3M SaaS pipeline."
https://6sense.com/customer-stories/callminer-powers-customer-expansion-with-health-score-driven-abm/	CallMiner	Large	computer software	"When enterprise software companies think about account-based marketing, they typically focus on new business acquisition. But CallMiner, a leader in AI-powered conversation intelligence, saw an opportunity to revolutionize how they engage with their existing customer base. By combining Gainsight health scores with 6sense’s targeting capabilities, they’ve created a sophisticated approach to customer expansion that’s transforming their enterprise relationships.     The Challenge   CallMiner was wrestling with a familiar challenge for enterprise software: helping customers maximize value from their platform. With customers spanning multiple industries and use cases, their technology often started in contact centers but has the power to deliver insights across departments.    “Our customers come in all different shapes and sizes, industries, and use cases,” says Alexandra Robson, global head of demand gen and marketing at CallMiner. This diversity created several hurdles:    Breaking through organizational silos that prevented wider adoption   Supporting customer champions in demonstrating value to other departments   Delivering relevant resources based on varying customer maturity levels   Identifying and engaging new stakeholders who could benefit from the platform   The Solution   Rather than taking a one-size-fits-all approach to customer marketing, CallMiner developed an innovative strategy using Gainsight health scores to drive their digital advertising through 6sense. This allowed them to segment customers based on maturity and tailor messaging accordingly.    “We segmented our adverts based on what customers need at different stages. Red health customers might need onboarding resources or information about our out-of-box solutions. Yellow health customers might benefit from best practices and community insights. And green customers, who are already doing well with our platform, might want to learn about new features or innovative use cases to enhance their ROI and business benefits.”  Alexandra Robson Global Head of Demand Gen This approach enables CallMiner’s customer success (CS) team to be more proactive in their customer engagement. Integration between 6sense’s digital advertising and internal customer success and growth workflows creates new opportunities for meaningful outreach. When the CS or growth team sees engagement with specific content, they can quickly follow up with relevant resources and support tailored to the customer’s maturity level. The strategy is particularly effective in large enterprises, where finding new stakeholders is crucial for expansion.  “Because we’re advertising at the account level rather than the person level, we can reach people within these organizations that we didn’t even know had an interest in these capabilities,” says Alexandra. “It helps our internal champions penetrate other parts of their business.”     The Results   CallMiner’s strategy has yielded promising early results, with particular success in driving influenced form fills and increased engagement from existing customers. This has helped the CallMiner team identify new stakeholders within their accounts and create opportunities for expansion.    But the impact goes beyond metrics. The program has transformed how CallMiner engages with customers, shifting from reactive to proactive engagement. “Historically, our approach has been a little more reactive than proactive.,” reflects Alexandra. “Now we’re more strategic about prioritizing where our teams spend their time.”    CallMiner’s ABM-focused strategy has delivered significant, quantifiable improvements across key customer metrics:   Account Health Progression:   50% of red health ABM target customer accounts advanced to yellow, compared to just 15% of red non-ABM accounts.  Likewise, 48% of yellow health ABM targets moved up to green, far outpacing the 19% seen in yellow non-ABM accounts.  Accelerated Value Realization:   Green health ABM accounts saw an average annual contract value (ACV) that was 10% higher than that of green standard (non-ABM) accounts.  These outcomes highlight the impact of CallMiner’s health score-driven ABM approach, accelerating customer maturity and driving higher revenue expansion across their customer base.    The success of their customer-focused ABM has also influenced their broader marketing strategy. CallMiner now maintains “always-on” campaigns for their top prospect accounts, segmented by vertical and aligned with sales priorities. This ensures marketing provides air cover while BDR and sales teams actively work on their target accounts.    By rethinking how ABM technology can serve existing customers, CallMiner has pioneered a new approach to enterprise customer engagement. Their innovative use of health scores for segmentation demonstrates how companies can use 6sense’s capabilities beyond traditional prospect targeting to drive value across their entire customer lifecycle.  "
https://6sense.com/customer-stories/reachdesk-achieves-35-win-rate-with-6sense-intent-data/	Reachdesk	Medium	marketing and advertising	"The sales team at Reachdesk, a global gifting platform, starts each day with a ritual that has revolutionized their pipeline: checking 6sense intent signals to identify their most promising opportunities.    Over the past three years, this routine has enabled Reachdesk to create a more efficient, data-driven sales process that consistently delivers measurable results.   The Challenge  Before implementing 6sense, Reachdesk struggled with a disjointed system that lacked centralized visibility into buyer intent. Their sales team faced significant challenges:   No clear way to identify which accounts were in-market and ready to buy  Limited visibility into prospect engagement with marketing content and their website  Difficulty prioritizing outreach efforts because of limited visibility into prospect buying stages  Inefficient targeting that led to lower conversion rates  No integrated view to show the interplay between marketing activities and sales engagement  “We just didn’t have an understanding of which accounts might be in-market, and couldn’t tie keyword searches or content consumption to website visitors,” says Ben Smith, Marketing Director at Reachdesk.    Ben adds, “It used to be that we were doing a lot of guesswork. Our outbound strategy lacked teeth because we didn’t really know who was ready. Now, we do.”    To power and improve their account-based marketing approach, Reachdesk needed a solution that would enable their team to make data-driven decisions about which accounts to prioritize and when to reach out.   The Solution  Reachdesk implemented 6sense as their intent data platform, making it a central part of their daily sales operations. BDRs pull daily reports of accounts showing 6sense intent signals. They examine the type of intent — website visits, keyword searches — through the 6sense widget in Salesforce. No need to switch between applications. The key info is right there in the CRM.     “Out of all the signals we look at on a daily basis, 6sense intent signals always seem to be the strongest in terms of who’s most likely to enter the funnel and ultimately close,” says Brandon Ray, Reachdesk’s Head of Global OB Demand Generation.    Ben shares that embedding 6sense into their entire go-to-market motion was key: “It’s not just a tool that marketing owns. Sales lives in it. Our entire GTM team treats it as the source of truth.”    This data provides insights into who is taking action within target accounts, which helps BDRs develop targeted outreach plans. Sales managers monitor the platform to ensure all signals are acted upon, while marketing creates segments to coordinate campaigns with sales activities.    Reachdesk also uses 6sense’s integration capabilities, connecting with Salesloft for orchestrated outreach and their own gifting platform to re-engage prospects. More recently, they’ve incorporated 6sense AI Email Agents to automate follow-ups, which has yielded impressive results.    “We ran a campaign with AI Email Agents. Anyone that had claimed a gift in the past through Reachdesk, we followed up with automated emails. We had a 50% close rate on opportunities generated from that play,” says Ben.   The Results  Reachdesk has seen measurable outcomes from 6sense that directly impact their revenue motion:   35% win rate from accounts showing 6sense buying signals (significantly above average)  65% conversion rate from key accounts to sales-accepted opportunities with 6sense intent data (compared to 50% for accounts without intent signals)  Greater global visibility into prospect engagement across EMEA, North America, and APAC regions    Ben sums it up: “It’s the difference between being reactive and proactive. We’re not waiting for someone to fill out a form — we’re reaching out to them at the right time, with the right message, because we can see the buying signals.”    About 6sense, Brandon says, “I can’t imagine a world without it. It would just be a guessing game in terms of who we should be reaching out to and when.” Combining 6sense intent data and Reachdesk’s gifting platform is what Brandon calls “the best one-two punch in terms of generating the type of pipeline that closes.” "
