Link	Customer Name	Customer Company Size	Customer Industry	Case Study Content
https://6sense.com/customer-stories/how-coveo-transformed-their-targeting-and-gtm-strategy-using-6sense/	Coveo	Large	information technology and services	"For Coveo, a leader in AI-powered search and generative experiences, aligning marketing and sales teams presented an ongoing challenge and opportunity. The marketing and business development teams have been working closely together under the CMO to maximize communication and collaboration. Through this alignment they discovered that their traditional lead-focused approach across four business lines relied heavily on manual tracking and more.   Inconsistent and disconnected account-level data made it hard to measure marketing campaign ROI and accurately prioritize accounts, resulting in missed opportunities and inefficiencies..  Recognizing the need for change, Coveo set out to bridge the gap between marketing and sales, improve their data, and create a unified strategy to identify and engage high-potential accounts.   They turned to 6sense for the tech, data and support to power their transformation. Since then, Coveo has transformed its revenue creation process, moving to a data-driven, account-based approach that has empowered their marketing and sales teams to work in lockstep, resulting in increased efficiencies, and an increase in influenced opportunities.  The challenge Before the shift, Coveo’s marketing and sales teams were operating in AE-focused pods to avoid silos, but without a unified strategy collaboration was harder than it had to be.   As George Samaras, director of marketing operations and technology says, “historically, our process was very inbound-focused. We’d get an MQL. Then we’d pass it off to a business development rep. The lead might convert. They might not.”  Key challenges included:  Fragmented data sources, leading to inconsistent and unreliable lead tracking. Lack of alignment between marketing and sales, resulting in poor collaboration. Difficulty in identifying and prioritizing high-intent accounts, causing inefficiencies in the pipeline. These issues led to missed opportunities at accounts, prompting Coveo to seek a solution that would bring their teams together and streamline the entire revenue creation process.  The solution The biggest shift was in philosophy. Coveo made a strategic shift from a traditional lead-focused model to an account-based marketing (ABM) approach running in tandem focused on top accounts. This meant adopting a new approach and new tools to align revenue generation efforts. The integration of 6sense into Coveo’s infrastructure played a crucial role in transforming their revenue process.  Establishing the vision Coveo kicked off the implementation of 6sense by holding vision-setting meetings to align teams on the shift to ABM. Coveo made it clear that their focus was moving from lead generation to targeting high-value accounts, laying the groundwork for long-term revenue growth. They also provided comprehensive training and enablement sessions to familiarize marketing and sales teams with 6sense’s capabilities.   “Recognizing the potential of 6sense to revolutionize our marketing and sales alignment, we invested in the tool and began to shift our focus towards account-centric targeting. This initial phase laid the foundation for our comprehensive ABM strategy.”  George Samaras Director of Marketing Operations and Technology, Coveo Creating buy-in and ownership Key stakeholders from both marketing and sales were involved early in the process to create a sense of ownership. Weekly meetings helped ensure ongoing alignment. Coveo also hired dedicated ABM managers to drive the strategy. This cross-functional buy-in was vital to the success of the 6sense rollout.  “We created incentives for teams to adopt the new approach. This included recognizing and rewarding employees who effectively utilized 6sense data to achieve their targets and contribute to the overall success,” says George.   Integrating 6sense into GTM efforts Coveo seamlessly incorporated 6sense data into their go-to-market (GTM) approach, using it to track Marketing Qualified Leads (MQLs) based on behavioral triggers such as content engagement, event attendance, and demo requests. 6sense’s buying stage insights were layered into these processes, helping sellers prioritize accounts with high purchase intent that were nearing a decision.  “The integration of 6sense into our GTM strategy has been transformative. It has enabled us to align our marketing and sales efforts more effectively, prioritize high-intent accounts, and drive significant revenue growth,” says Mike Raley, SVP of Marketing.  Using 6sense Intent Data By monitoring 6sense Intent Scores, Coveo was able to segment leads into different stages of the buyer’s journey — TOFU, MOFU, BOFU — and tailor their nurture flows accordingly. Daily Hot Account alerts were sent to account executives and SDRs, allowing them to act quickly on accounts displaying high intent.  “6sense not only highlights accounts that are ready to engage — but what I like (and probably the most rewarding feature) is the “recent intent activities” that show up when you start outbounding to those accounts so you can see the results of your work.”  Haniya Hussain Sales Development Representative, Coveo Account monitoring and targeting Coveo also incorporated 6sense data into their Top Account Obsession play, using 6sense’s Account Profile Fit to identify high-potential accounts. Salesforce and Tableau dashboards further supported their efforts, providing real-time insights into account movement and campaign metrics to optimize resource allocation and engagement.  “6sense allows me to easily sort through my accounts to ensure I’m always prioritizing outreach to the accounts that are most likely to engage back. What’s even better is that with 6sense’s keyword data, I’m able to personalize my outreach to the specific area of interest that I’m seeing within the account.,” says James Ford, sales development representative.  The results Since integrating 6sense into their revenue process, Coveo has experienced significant improvements in both marketing and sales performance.   The ability to identify Marketing Qualified Leads (MQLs) that are in the Decision and Purchase stage has led to more precise targeting and outreach.  Daily monitoring and prioritization of high-intent accounts has allowed Coveo to allocate resources more effectively, leading to increased conversion rates.  In just 9 months in 2024, Coveo created 42 new business opportunities influenced by account-based GTM efforts — an increasingly meaningful contribution to overall pipeline creation. The impact across departments has been substantial:  Marketing: Precision targeting and personalized campaigns based on 6sense’s intent data have increased engagement and campaign efficiency, leading to higher conversion rates. Sales: Improved prioritization of high-intent accounts has resulted in more focused efforts, shorter sales cycles, and better conversion rates. Operations: The unification of data and automated workflows have streamlined pipeline management, reducing manual work and enabling faster, data-driven decision-making. These changes have fostered a culture of alignment and data-driven decision-making, positioning Coveo for continued success.  “6sense is our foundation for developing a precise and effective ABM ecosystem. It empowers us with unparalleled insights into buyer intent, guiding us to deliver personalized experiences and foster meaningful engagements that drive transformative business outcomes,” says Marilou Simard-Baril, Head of Account-Based Marketing."
https://6sense.com/customer-stories/bonterras-journey-with-6sense-transforming-abm-with-predictive-ai-and-sales-alignment/	Bonterra	Large	computer software	"Bonterra is one of the fastest-growing social good software companies in the world. Through innovative solutions for fundraising, corporate social responsibility, and case management, Bonterra is working towards increasing giving to 3% of U.S. GDP by 2033, unlocking $573 billion for more global good annually.   Justin Lopez, account-based marketing manager (ABM) at Bonterra, shares how the company pivoted their marketing strategy by implementing 6sense’s AI-powered revenue platform. Bonterra significantly improved targeting, engagement, and overall efficiency by focusing on account-based marketing (ABM).   The challenge: Overcoming inbound limitations and lack of account visibility Historically, Bonterra heavily relied on inbound leads to drive their sales pipeline. While this approach generated high lead volumes, it didn’t always translate into meaningful pipeline growth. The company faced several challenges:  Inbound limitations: The heavy focus on inbound marketing left in-market buyers untouched with strategies to capture their buying intent.  Lack of sales and marketing alignment: Sales and marketing felt a disconnect on target accounts. Sales lists churned quickly and were based on ICP fit that weren’t always aligned to Marketing definitions and there were no coordinated activities against these activities.   Challenges with targeting and messaging: Difficulties in refining targeting and aligning messaging limited Bonterra’s ability to effectively engage key accounts.  The solution: Implementing a sales-first, multi-channel ABM strategy Bonterra added 6sense Sales Intelligence to their predictive AI and ABM use case to shift from inbound only to outbound sales focused on 6sense insights. The implementation focused on refining targeting, improving sales alignment, and increasing campaign efficiency.   Smarter targeting with predictive AI: 6sense’s predictive analytics gave Bonterra insight into where accounts were in their buying journey. This helped prioritize high-intent accounts, allowing the team to focus on the most valuable opportunities.  Sales and marketing alignment: Bonterra emphasized close collaboration between sales and marketing to identify target accounts. They created POD models where AEs and BDRs meet weekly to discuss 6QAs and recent activities from key accounts, and next steps on multithreading. By working together, both teams aligned on account priorities and messaging, ensuring consistent outreach.  Multi-channel ABM campaigns: Audiences were synchronized across platforms like Meta and LinkedIn, ensuring target accounts received consistent messaging wherever they engaged. This multi-channel approach enhanced engagement. Data-driven optimization: Bonterra used real-time engagement data to refine their campaigns, focusing efforts on accounts showing the highest engagement. This data-driven approach improved overall campaign performance and resource allocation. 6sense’s Sales Intelligence dashboard has been a game changer for Bonterra’s sellers, namely the ‘Recent Activities’ tab and ‘Discovery’ feature. The ‘Recent Activities’ tab surfaces inbound actions like form fills and specific web visits. The ‘Discovery’ feature allows sellers to see engaged contacts that are increasing or decreasing engagement over a 7-day span. For Bonterra, the ‘Discovery’ feature helped find net-new contacts at their target accounts who have visited the website.   The information provided on 6sense dashboards has lit up Bonterra’s Dark Funnel, enabling sellers to have more guidance on which accounts to go after. Since using Sales Intelligence, Bonterra has noted an increase in website visits from target accounts.  “The ability for our go-to-market team to see which of our key accounts are engaging with our website or marketing ads in nearly real-time is a complete game-changer.”  Justin Lopez Account-Based Marketing Manager, Bonterra The results: Driving higher engagement and improved sales-marketing alignment After implementing 6sense, Bonterra experienced a transformative shift in how they approached marketing. With data-driven insights and enhanced collaboration between sales and marketing, the company saw substantial improvements in targeting, engagement, and overall efficiency.   “Comparing our account-based marketing ads to our non-ABM ads, we see both higher conversion rates and higher click-through rates. Across the board, our ABM metrics are stronger,” says Justin.   Here are Bonterra’s wins using 6sense since January of 2024:   6sense programs influenced $6M in pipeline, which is a 445% increase from the previous fiscal year 6763 target accounts driven to website  “Everything we’re doing from an outbound perspective would be so much harder without 6Sense,” admits Justin.   A data-driven path to Bonterra’s future growth By embracing 6sense’s AI-driven platform, Bonterra successfully transitioned from a dependence on inbound leads to a proactive, account-based marketing strategy. The synergy between sales and marketing improved engagement with key accounts and drove significant increases in conversion rates and overall efficiency in their go-to market strategy.  Bonterra’s journey illustrates the transformative power of predictive analytics and cross-team collaboration in executing effective ABM strategies. The company’s success is a valuable example for organizations looking to improve the efficiency of their marketing program while achieving greater alignment between sales and marketing teams."
https://6sense.com/customer-stories/marathon-healths-marketing-was-lonely-with-no-insights-now-they-have-millions-in-pipeline/	Marathon Health	Large	hospital & health care	"For years, Marathon Health, a nationwide network healthcare solution, risked missing out on millions of dollars of pipeline due to an overworked and understaffed go-to-market team. Capacity issues plagued their marketing and sales teams, resulting in too many unaddressed inbound requests, ignored accounts, and gaps in their marketing-to-sales qualification process.   But that’s not the case these days.   “When we implemented 6sense, we found higher quality leads, and drove net-new sales,” explains Troy Purdue, the company’s Director of Growth Marketing. ”Ultimately, it opened the door for us to engage with more members and change more people’s lives through the healthcare services we provide.”   Here’s how Marathon Health harnessed 6sense’s capabilities to streamline their sales process and attach millions of pipeline to marketing campaigns.   The challenge: Marketing or ‘arts and crafts’? Back in 2020, Marathon Health’s tech stack was  “lonely with no insights,” Troy confesses. Worse still, the marketing team fulfilled creative requests but had no demand-generation capabilities.  “The marketing team was what I would call an ‘arts and crafts’’ department,” Troy says. “We were putting flyers together, PowerPoint presentations, and all the standard type stuff that marketing would do. But marketing was not responsible for pipeline.”   While marketing was busy decorating posters, Marathon Health’s sales team purchased lists of contacts and made cold calls. This was a lengthy and oftentimes wasteful sales cycle because they were calling customers who had no intent to purchase.   Marathon Health’s previous tech stack provided a limited view of first-party data. It couldn’t deliver the crucial insights a sales team needs to reach companies that are actually looking for a solution. Deficiencies in the middle of the funnel meant Marathon Health lacked the resources to contact and nurture thousands of leads.   To scale the business and make a bigger impact, Marathon Health needed a solution to:   Empower their small marketing team to expand capabilities  Get better account insights, and  Own a pipeline number To meet this need, Marathon Health added 6sense to their toolkit in 2021. They adopted an omnichannel approach to their outreach, uniting all aspects of the buyer journey across all channels. They then later joined 6sense’s Email Agents beta in 2022 to help the sales team engage more efficiently with prospects.   Building a unique playbook with an omnichannel approach  Marathon Health first used 6sense in 2021 to build a unique omnichannel playbook that empowered them to monitor the impact of their engagement on the city level.   Geography is important in Marathon Health’s go-to-market strategy as the company is expanding their health center locations nationwide. The 6sense approach divided customers into segments based on zip codes and then AI-based scoring to view the marketing funnel at a granular level.  Next, 6sense’s orchestrations and Salesforce integrations equipped Marathon Health’s revenue team with access to data-complete accounts ready for engagement across multiple platforms.   Marathon Health’s omnichannel marketing playbook included:   Targeted ads customized for each market and stage Direct mail delivered to all companies meeting in the Ideal Customer Profile (ICP)  AI-driven email journeys customized by buyer personas and market After initial targeting, sales development representatives (SDRs) handled the accounts that signaled a high intent to purchase. SDRs would engage these accounts with customized outreach on LinkedIn or phone calls.  Troy says 6sense makes it easy to monitor the impact of engagement levels per city and adjust the strategy or budget to yield better results more quickly. This omnichannel approach made the Marathon Health team more nimble and dramatically increased in-market buying growth.   However, they still had one gap to fill: contacting people via email at scale. That’s where 6sense’s Email Agents came into play.   Leveling up with Email Agents 6sense introduced a beta program for its Email Agents capability in the summer of 2022, and Marathon Health participated.   Email Agents is an AI-powered personalization tool that streamlines conversations by writing emails and responding to replies at scale. Agents treat every opportunity with high-quality engagement by replying to emails at any time, looping in necessary people, and understanding out-of-office messaging.   Since Marathon Health didn’t have the resources to contact thousands of people and nurture them through the marketing funnel, Email Agents gave Troy’s small team the capacity to contact more people and customize messaging based on geography, the industry, and the number of employees.   As a solution that offers in-person health networks based on geography, Marathon Health used Email Agents to create a targeted email journey personalized by city.  Within the first two months of using Email Agents, Marathon Health sent more than 22,000 emails with open rates reaching 38%, resulting in $4.5M in net-new pipeline. This percentage is a 55% increase over average email open rates from other health companies.   “If you can create a highly relevant email stream speaking specifically to the problems of your prospects, you can generate really, really high open rates, engagement rates, and ultimately closed-won deals,” Troy says.   Email Agents enables Marathon Health’s sales team members to engage more effectively with contacts and drive them further down the funnel.   This confidence extends to the marketing team, too.   “The marketing team owns a pipeline number now,” Troy says. “Talk about confidence when we didn’t have that before! We’re confident that not only can we meet that pipeline number, but exceed it.”   The results Marathon Health introduced 6sense in 2021 and generated astounding results after launching their first set of ad campaigns. Before using 6sense, Marathon Health’s pipeline and in-market buying growth were close to zero.   The results since July 2021:   $66M in net-new pipeline 211% in-market buying growth  In 2022, Marathon Health added Email Agents to close the conversation gap. Over the course of eight weeks and 22,000+ emails sent, Email Agents delivered:   11 qualified leads 908 accounts $4.5M net-new pipeline generated  In using the 6sense Revenue Intelligence Platform, Troy’s team can reach more people — and impact more lives — with Marathon Health’s services.   “We’re really just scratching the surface,” he says “If we can continue to invest in tools like 6sense and Email Agents and integrate other partners and platforms with 6sense, look at how much more we can generate and grow. That has instilled a level of confidence in me to be able to go to leadership and say, ‘let’s continue to do these wonderful things.”"
https://6sense.com/customer-stories/wake-the-dead-how-clari-used-6sense-display-ads-to-win-back-lost-accounts/	Clari	Medium	computer software	"When dealing with closed-lost accounts, most companies cut their losses and move on.   But Clari isn’t like most companies. Instead, they closely examine closed-lost accounts and find new ways to bring them back to life.   Or, at least, that’s what Tyler Pleiss and Derek Antti — Clari’s Senior Marketing Manager and Revenue Development Manager, respectively — set out to do with their recent “Wake the Dead” account-based strategy.  Using 6sense display ads, Clari’s Wake the Dead strategy reinvigorates closed-lost accounts. The initiative recently resulted in $1 million of qualified pipeline in just one quarter.   Clari secured major wins through Wake the Dead, but achieving these results first required learning how to take full advantage of 6sense’s solution.  The challenge Tyler and Derek joined Clari in early 2022. Although Clari was already using 6sense at the time, their revenue team was not using the platform to its full potential.   For instance, the team didn’t fully understand how to best leverage 6sense data, resulting in a “spray and pray” go-to-market strategy. Instead of focusing on logos expressing genuine buying intent, Clari’s sellers targeted any big brand that came to mind.   On top of that, the results they were seeing from LinkedIn Advertising hit a plateau. Tyler explains: “We got to a point, especially on the marketing side, where we were running a lot of stuff at one time. That can sometimes oversaturate the people you’re targeting.”   So, Tyler and Derek empowered their team to optimize 6sense data and capabilities, which culminated in its ultra-successful Wake the Dead strategy.   The solution Losing an opportunity doesn’t mean it’s gone forever. Further, the reasons why accounts don’t turn into a win can change or vanish over time. Looking back on a year’s worth of closed-lost opportunities, Clari sought specific criteria such as failure to launch, meeting no-shows, bad timing,  executive turnover, and budget restrictions.   To revive these closed-lost accounts, Clari had to:   Align revenue development managers (RDRs) and account executives  Align on messaging and assets, and Launch display ads using 6sense Clari’s use of 6sense Display Ads targets senior-level personas and sends them to curated landing pages powered by Folloze, a buyer experience platform.   Once accounts reach Clari’s website, Derek’s team of RDRs receives those buying signals and targets the proper accounts to generate new opportunities.   “It gives our RDRs another avenue that’s outside of outbound or following up with inbound,” Derek says. “Then you couple this with 6sense, where you get the data that tells you who to chase down and what they’re interested in.”  The results With 6sense, Clari’s revenue team went from making educated guesses to knowing exactly who to target and how.   As Tyler wrote in an article on LinkedIn, Clari targeted 42 accounts with a goal of six meetings booked, four qualified meetings, and $500k in pipeline.   By the end of Q4 of the 2023 fiscal year, they achieved:  Eight meetings booked  Five qualified meetings worth over $1.1M in pipeline  6sense Display Ads reached all 42 accounts with a 79% account click-through rate (CTR).   Additionally, 93% of accounts engaged with display ads, and 67% showed increased engagement on Clari’s website.   From a cultural perspective, Clari’s internal adoption of 6sense has produced impressive results. For example, from Q1 of the fiscal year 2024, 43% of meetings booked have come from 6sense purchase and decision accounts.   “We’ve seen 6sense be considered a strong source of data to help all of our sellers align their focus and attention on the accounts they target for the year, the quarter, the week, and the day,” Derek says."
